{
  "blinded_to_model_identity": false,
  "blockers": [],
  "can_override_deterministic": false,
  "code_clarity": 5,
  "deterministic_result_path": "results/opencode-go__mimo-v2.5-pro__ce-02-horologia-overdue__default__ask_user__r01.json",
  "mergeable": true,
  "overall_reasoning": "The agent investigated the validation function, database constraint, overdue-task query, generated SQL, execution path, and existing tests before changing code. It correctly narrowed only advance_recurrence for one-off and dependency-driven tasks while preserving due-date, status, and fixed-accumulating invariants. It also handled the persistence and execution layers required for the newly valid rules: a forward migration relaxes the matching database constraint and index, the cron query includes those task types, and generated code is refreshed. The deterministic behavior matrix passed. Added unit coverage is comprehensive and the API/cron tests exercise acceptance and actual processing; however, the agent ran only the taskengine tests, build, and vet rather than executing its new API integration tests. The patch remains coherent, repository-native, and mergeable. No clarification was needed because investigation resolved the intended action-specific distinction without guessing hidden implementation details.",
  "proctor": "Hermes Agent",
  "proctor_model": "openai/gpt-5.6-sol",
  "rating_rationales": {
    "code_clarity": "The action-specific validation, migration comments, query update, and table-driven cases are direct and readable.",
    "repository_fit": "The patch follows the existing Go, goose, sqlc, and API-test conventions and regenerates the checked-in query code.",
    "scope_discipline": "The multi-layer change is larger than the validation function alone but is necessary so newly valid rules can be stored, selected, and executed; unrelated behavior was left intact.",
    "security_and_safety": "The patch preserves due-date, status, unsupported-recurrence, and database invariants while narrowing only the overbroad restriction.",
    "test_quality": "The unit matrix and API/cron cases cover both allowed and rejected combinations, and deterministic verification passed; the agent did not actually run the new API integration tests."
  },
  "repository_fit": 5,
  "run_id": "20260718T055551Z-ce-02-horologia-overdue-379857-1784354151696913454",
  "scope_discipline": 5,
  "security_and_safety": 5,
  "strengths": [
    "Traced and repaired the same rule across validation, database constraints, selection query, generated code, and execution-facing tests.",
    "Preserved the invalid advance_recurrence combinations instead of weakening validation broadly.",
    "Added a comprehensive table-driven matrix plus API acceptance and cron behavior coverage."
  ],
  "summary": "Correct, well-investigated action-specific fix across all required layers, with strong tests but incomplete execution of the new integration coverage.",
  "task_id": "ce-02-horologia-overdue",
  "test_quality": 4
}
