{
  "blinded_to_model_identity": false,
  "blockers": [
    "the fallback does not preserve the std::source_location-compatible API: file_name() and function_name() return std::string_view rather than const char*, and the type is not default-constructible"
  ],
  "can_override_deterministic": false,
  "code_clarity": 2,
  "deterministic_result_path": "results/neuralwatt__qwen3.6-35b__ce-04-maplibre-source-location__default__ask_user__r01.json",
  "mergeable": false,
  "overall_reasoning": "The patch correctly removes the undefined extension of namespace std, introduces one shared compatibility header, updates the affected declarations and definitions, preserves call-site capture through SYM_GUARD_LOC, and registers the header in both requested build manifests. However, its claimed API compatibility is materially false: the fallback accessors return std::string_view while std::source_location returns const char*, and the const data members plus custom constructors eliminate the standard type's empty/default state. The deterministic verifier catches both defects while compiling a normal consumer, so native, fallback, and manifest credit all remain zero because the behavioral test cannot build. This is a valid semantic failure rather than infrastructure or wording sensitivity. The implementation also detects the feature-test macro before including <source_location>, making standard-path selection depend on transitive includes, and places generic names in the global namespace rather than the repository namespace. The agent performed extensive repository exploration but only ran narrow syntax-only snippets tailored to its implementation; it did not compile the actual consumer API, exercise default construction or return types, or build a relevant repository target. No clarification was necessary because matching source_location behavior and supporting both paths were explicit requirements.",
  "proctor": "Hermes Agent",
  "proctor_model": "openai/gpt-5.6-sol",
  "rating_rationales": {
    "code_clarity": "The header is heavily commented and locally readable, but the comments repeatedly promise API equivalence that the signatures do not provide; feature detection and duplicated compiler branching are also brittle.",
    "repository_fit": "The patch updates the established CMake and Bazel manifests and all affected call sites, but exposes generic fallback types in the global namespace and relies on feature-test state established by transitive includes.",
    "scope_discipline": "Changes are confined to the compatibility header, affected source-location call sites, and requested build manifests, though replacing types across several files increased surface area without preserving the original interface.",
    "security_and_safety": "This diagnostics-only compatibility change has no external side effects or security-sensitive behavior; its risks are compile-time portability and API correctness.",
    "test_quality": "The agent ran only synthetic syntax-only snippets that mirrored its own constructors. It did not test std-compatible accessor types, default construction, runtime call-site values, the forced fallback consumer, or a repository build target."
  },
  "repository_fit": 2,
  "run_id": "20260717T221036Z-ce-04-maplibre-source-location-2667985-1784326236192187401",
  "scope_discipline": 3,
  "security_and_safety": 4,
  "strengths": [
    "Removed the non-standard namespace std extension and centralized source-location compatibility.",
    "Preserved useful call-site macro expansion on the fallback path.",
    "Updated both CMake and Bazel manifests as requested."
  ],
  "summary": "Well-scoped compatibility refactor, but not mergeable because the fallback breaks the source_location consumer API and fails deterministic compilation.",
  "task_id": "ce-04-maplibre-source-location",
  "test_quality": 1
}
