{
  "blinded_to_model_identity": false,
  "blockers": [
    "The patch leaves noisy stdout from fetch, pull, and recursive submodule operations in antidote-update; hidden verification shows normal update output remains contaminated and wrapper diagnostics are not routed to stderr."
  ],
  "can_override_deterministic": false,
  "code_clarity": 5,
  "deterministic_result_path": ".runs/20260717T052212Z-ce-01-antidote-output-candidate-1784265732707160874/verification.json",
  "mergeable": false,
  "overall_reasoning": "The candidate produced a strong implementation and test package for one affected path. However, the prompt concerned Antidote leaking wrapper output, and the candidate explicitly reviewed antidote-update before deciding it was out of scope. The calibrated verifier requires the same stdout-to-stderr discipline for fetch, pull, and submodule operations. Because those omissions cause both hidden assertions to fail, the patch is not mergeable as the complete requested fix. Qualitative strengths cannot override the deterministic result.",
  "proctor": "Hermes Agent",
  "proctor_model": "OpenAI GPT-5.6 Sol",
  "rating_rationales": {
    "code_clarity": "The production change is a minimal, idiomatic redirection whose behavior is clear from the adjacent regression specification.",
    "repository_fit": "The literate clitest additions follow repository conventions and restore the mocked Git function, though the stream-isolation case is necessarily somewhat intricate.",
    "scope_discipline": "The change is narrowly scoped and avoids unrelated edits, but it narrows the task too far by excluding update-side Git operations after inspecting them.",
    "security_and_safety": "The patch introduces no privilege, network, secret, or unsafe execution changes and preserves error diagnostics instead of hiding them.",
    "test_quality": "Coverage reproduces the bug, isolates stdout and stderr under Zsh MULTIOS, rejects the original behavior and an over-silencing mutant, and accompanies a complete 687-test run."
  },
  "repository_fit": 4,
  "run_id": "20260717T050753Z-ce-01-antidote-output-3302403-1784264873797938840",
  "scope_discipline": 3,
  "security_and_safety": 5,
  "strengths": [
    "Correctly identified and fixed the clone-side stdout contamination without suppressing diagnostics.",
    "Added focused literate regression coverage for both clean generated stdout and preserved stderr diagnostics.",
    "Demonstrated that tests fail with the original bug and with an over-silencing mutant, then passed all 687 candidate-visible tests."
  ],
  "summary": "High-quality but incomplete solution: the clone path is fixed and exceptionally well tested, while the update path required by the calibrated task contract remains unfixed. Deterministic verification therefore correctly fails.",
  "task_id": "ce-01-antidote-output",
  "test_quality": 5
}
