{
  "blinded_to_model_identity": false,
  "blockers": [],
  "can_override_deterministic": false,
  "code_clarity": 5,
  "deterministic_result_path": "results/opencode-go__kimi-k2.7-code__ce-01-antidote-output__default__ask_user__r01.json",
  "mergeable": true,
  "overall_reasoning": "The agent traced the contamination to the clone subprocess used while generating plugin scripts and applied the direct stream-preserving fix: clone stdout is redirected to stderr while existing stderr and the command status remain intact. The patch is narrowly scoped, follows the repository's Zsh and clitest conventions, and introduces no unrelated behavior or dependencies. The committed regression proves generated stdout remains valid when a git wrapper emits stdout; the agent also manually checked that the wrapper output surfaces on stderr. The deterministic verifier independently confirmed the complete stream contract. Focused and full repository-native suites passed. No clarification was needed because the requested behavior and scope were clear.",
  "proctor": "Hermes Agent",
  "proctor_model": "openai/gpt-5.6-sol",
  "rating_rationales": {
    "code_clarity": "The one-line stream redirection is idiomatic and self-explanatory, and the regression explains the real wrapper behavior it covers.",
    "repository_fit": "The change uses the existing Zsh implementation and clitest Markdown conventions without adding abstractions or dependencies.",
    "scope_discipline": "The production edit is confined to the offending clone command and paired with one focused regression.",
    "security_and_safety": "Redirecting stdout to stderr preserves useful progress and failure diagnostics, retains the clone exit status, and prevents generated code contamination.",
    "test_quality": "The committed regression exercises a noisy wrapper through the real script-generation path, and focused plus full suites passed. It implicitly checks clean stdout; an explicit committed stderr assertion would make the diagnostic-preservation contract even clearer."
  },
  "repository_fit": 5,
  "run_id": "20260718T013422Z-ce-01-antidote-output-3469076-1784338462211438630",
  "scope_discipline": 5,
  "security_and_safety": 5,
  "strengths": [
    "Identified the exact clone subprocess contaminating generated output.",
    "Preserved diagnostics by moving wrapper stdout to stderr rather than discarding it.",
    "Added focused repository-native coverage and ran both focused and full test suites."
  ],
  "summary": "Correct, proportional, and mergeable stream-isolation fix with useful regression coverage and thorough verification.",
  "task_id": "ce-01-antidote-output",
  "test_quality": 4
}
