{
  "blinded_to_model_identity": false,
  "blockers": [
    "The patch leaves noisy stdout from fetch, pull, and recursive submodule operations in antidote-update; deterministic verification shows normal update output remains contaminated and wrapper diagnostics are not routed to stderr."
  ],
  "can_override_deterministic": false,
  "code_clarity": 5,
  "deterministic_result_path": ".runs/20260717T073056Z-ce-01-antidote-output-candidate-1784273456065286543/verification.json",
  "mergeable": false,
  "overall_reasoning": "The candidate correctly diagnosed, reproduced, and fixed the clone-side stream contamination, then added repository-native regression tests and committed a clean change. However, the task concerns Antidote leaking output from the noisy Git wrapper, and the candidate inspected antidote-update without applying the same stream isolation to its operational fetch, pull, and submodule calls. Those omissions cause the valid semantic verifier's update assertions to fail, so the patch is not mergeable as a complete fix. Qualitative strengths do not override the deterministic failure.",
  "proctor": "Hermes Agent",
  "proctor_model": "OpenAI GPT-5.6 Sol",
  "rating_rationales": {
    "code_clarity": "The production change is a minimal, idiomatic redirection, and the literate test descriptions clearly state the stream contract.",
    "repository_fit": "The tests use the repository's clitest style, existing mockgit helper, and cleanup conventions; the committed patch is localized to relevant source and test files.",
    "scope_discipline": "The patch avoids unrelated edits but under-scopes the fix to clone even after inspecting antidote-update, leaving equivalent noisy operational Git calls untreated.",
    "security_and_safety": "The change introduces no privilege, network, secret, or unsafe execution behavior and correctly preserves clone diagnostics rather than discarding them.",
    "test_quality": "The focused tests reproduce clone contamination and protect generated stdout, and the candidate demonstrated the regression against the original source and ran 627 unit tests. They do not cover the analogous update path or directly assert preserved stderr in the committed suite."
  },
  "repository_fit": 5,
  "run_id": "20260717T071531Z-ce-01-antidote-output-3726935-1784272531111477272",
  "scope_discipline": 3,
  "security_and_safety": 5,
  "strengths": [
    "Correctly traced generated-script stdout through the single-bundle clone path and reproduced the reported wrapper behavior before editing.",
    "Applied the correct clone-side stdout-to-stderr routing while preserving exit status and diagnostics.",
    "Added focused, repository-native regression coverage, proved it rejected the original behavior, ran the full visible unit suite, and committed the finished change."
  ],
  "summary": "Strong but incomplete solution: clone-side output isolation is correct and well investigated, while equivalent update-side Git operations remain unfixed, so deterministic verification validly fails.",
  "task_id": "ce-01-antidote-output",
  "test_quality": 4
}
