{
  "blinded_to_model_identity": true,
  "blockers": [
    "The submitted patch is empty, so the requested declarative CI policy and workflow generator are not implemented.",
    "No `ci:generate-workflow` mise task or non-mutating `--check` mode was added.",
    "No checked-in generated workflow or CI drift enforcement was added.",
    "No generator tests were added."
  ],
  "can_override_deterministic": false,
  "code_clarity": 1,
  "deterministic_result_path": ".runs/experiments/real-models-v1-behavioral-rerun-ce06/results/opencode-go__kimi-k2.7-code__ce-06-maplibre-ffi-ci__default__ask_user__r01.json",
  "mergeable": false,
  "overall_reasoning": "The task required a declarative CI support policy, a generator for the checked-in workflow, the specified mise generation and check commands, sync enforcement, tests, and a finished committed change. None of these deliverables appear in the empty patch. Repository investigation and a proposed TOML architecture are preliminary work only and cannot be merged as a solution.",
  "proctor": "Independent model-blind reviewer",
  "proctor_model": "openai-subscription/gpt-5.6-sol",
  "rating_rationales": {
    "code_clarity": "There is no submitted code, manifest, task definition, generated artifact, or documentation to evaluate for clarity.",
    "repository_fit": "Although the trajectory examined relevant repository conventions such as mise tasks and `.mise/config.*.toml`, none of those findings were translated into a repository-integrated patch.",
    "scope_discipline": "The candidate correctly identified the requested work but stopped before making any changes. The optional manifest-format question did not justify leaving the entire task unimplemented.",
    "security_and_safety": "The empty patch introduces no new security or safety risk, though this does not compensate for the missing implementation.",
    "test_quality": "No generator tests, drift-check tests, or other validation changes were submitted."
  },
  "repository_fit": 1,
  "run_id": "20260721T172254Z-ce-06-maplibre-ffi-ci-3207913-1784654574907362837",
  "scope_discipline": 1,
  "security_and_safety": 5,
  "strengths": [
    "The repository exploration identified the existing workflow, mise target profiles, and relevant CI setup action.",
    "No unsafe or security-sensitive changes were introduced."
  ],
  "summary": "Not mergeable: the trajectory only inspected the repository and proposed an architecture question, while the submitted patch contains no implementation or tests.",
  "task_id": "ce-06-maplibre-ffi-ci",
  "test_quality": 1
}
