{
  "blinded_to_model_identity": false,
  "blockers": [],
  "can_override_deterministic": false,
  "code_clarity": 5,
  "deterministic_result_path": "results/zai__glm-5.2__ce-02-horologia-overdue__default__ask_user__r01.json",
  "mergeable": true,
  "overall_reasoning": "The patch correctly narrows the domain rule by action rather than broadly allowing overdue rules: advance_recurrence remains limited to recurrence types it can actually advance, while set_status and clear_due_date become available to any task with a due date. Investigation followed the behavior through application validation, the database constraint and index, and cron selection, avoiding a validation-only fix that would accept inert or unpersistable rules. The migration, source SQL, and generated query stay consistent. Tests cover the action-by-recurrence matrix, API persistence, and an end-to-end cron execution path; the agent also ran the complete server suite, build, vet, and formatting checks. No clarification was needed because repository semantics resolved the scope.",
  "proctor": "Hermes Agent",
  "proctor_model": "openai/gpt-5.6-sol",
  "rating_rationales": {
    "code_clarity": "The recurrence capability helper and action-specific validation make the domain rule explicit, and comments explain why each task type is accepted or rejected.",
    "repository_fit": "The change follows the existing Go, sqlc, Goose migration, and API-test conventions and keeps generated SQL synchronized with its source query.",
    "scope_discipline": "Although six files change, each is a necessary layer of the same invariant: validation, persistence, query execution, generated code, and focused tests.",
    "security_and_safety": "The patch preserves due-date and set-status requirements, strengthens database defense for fixed_accumulating tasks, and provides a reversible migration without bypassing validation.",
    "test_quality": "The tests exercise the full semantic matrix and include API and cron behavior that jointly cover validation, migration constraints, query eligibility, and action execution; full server tests also passed."
  },
  "repository_fit": 5,
  "run_id": "20260717T160715Z-ce-02-horologia-overdue-1420651-1784304435700983320",
  "scope_discipline": 5,
  "security_and_safety": 5,
  "strengths": [
    "Traced all four enforcement points instead of stopping at the visible validator.",
    "Encoded the action-specific recurrence capability directly and retained existing invariants.",
    "Added matrix and end-to-end coverage and verified the complete server suite."
  ],
  "summary": "Mergeable domain-correct fix that aligns validation, persistence, cron selection, and tests for overdue actions.",
  "task_id": "ce-02-horologia-overdue",
  "test_quality": 5
}
