{
  "blinded_to_model_identity": true,
  "blockers": [],
  "can_override_deterministic": false,
  "code_clarity": 4,
  "deterministic_result_path": ".runs/experiments/real-models-v1-behavioral-rerun-ce06/results/openai-subscription__gpt-5.6-sol__ce-06-maplibre-ffi-ci__default__ask_user__r01.json",
  "mergeable": true,
  "overall_reasoning": "The patch fully implements the requested declarative CI policy: manifests are the source of truth, the checked-in workflow is generated and marked as such, drift is enforced in hygiene via a non-mutating check, and the contributor commands match the specification exactly. Behavioral equivalence with the handwritten workflow was verified both by reading the old predicates against the new workload lists and by tests that pin runners, ordering, and commands. The trajectory shows real verification: unit tests passed, ruff passed, mise task invocation and argument forwarding were confirmed, and two self-review rounds led to concrete hardening (empty-workload rejection, YAML-safety validation, stronger preservation assertions). Remaining nits (magic blank-line indices, hand-rolled YAML emission, unrun actionlint in the sandbox) are non-blocking and are covered by the repository's own CI hygiene. Nothing here overrides deterministic grading; on qualitative merits the patch is suitable to merge.",
  "proctor": "Independent model-blind reviewer",
  "proctor_model": "kimi-subscription/kimi-k3",
  "rating_rationales": {
    "code_clarity": "Generator is small, typed, and readable with a clear load/validate/render/check pipeline. Deductions for the magic blank-line indices ({1, 8}) used to preserve visual grouping in rendered output, and for hand-rolled YAML line emission with a bespoke plain-scalar safety check rather than a real YAML emitter; both are acceptable at this size but are mild maintainability smells.",
    "repository_fit": "Uses the repo's pinned Python with stdlib only, unittest (no new test dependency), ruff-formatted code, existing ci:* mise task naming, ci:lint as the enforcement point, and the development overview for contributor docs. The required commands `mise run ci:generate-workflow` and `-- --check` work as specified and were exercised in the trajectory.",
    "scope_discipline": "Touches only the CI policy domain: new .github/ci/ manifests/generator/tests, the regenerated workflow, mise task wiring, and a short docs note. No unrelated refactors; the tempting larger scope (generating mise env files, devcontainer matrices) was deliberately deferred, consistent with the task's behavior-preservation constraint.",
    "security_and_safety": "Preserves permissions: contents: read and the pinned checkout action SHA; adds no secrets, network access, or third-party dependencies. --check is non-mutating (verified by test). Manifest values are validated against conservative YAML-safety patterns before interpolation into the workflow, so malformed input fails closed rather than producing a subtly altered workflow.",
    "test_quality": "Eight unittest cases pin the exact prior policy (target order, runners, backends, providers, workload membership, step names, and commands), verify render determinism, exact membership-condition emission, non-mutation of drifted files, and rejection of empty workload lists. Slight redundancy from snapshot-style duplication of manifest content is intentional for behavior preservation. actionlint could not be run in the sandbox (tool download blocked), but the workflow syntax is simple and CI hygiene will run it."
  },
  "repository_fit": 5,
  "run_id": "20260721T170405Z-ce-06-maplibre-ffi-ci-3146154-1784653445645623694",
  "scope_discipline": 5,
  "security_and_safety": 5,
  "strengths": [
    "Generated workflow preserves the exact previous behavior: all eleven target/runner pairs, per-target workload applicability (iOS build-only, macos-arm64-egl exclusions, Vulkan-only LWJGL, Kotlin/Native exclusions), step order, job names, timeouts, and required-job aggregation are byte-comparable to the handwritten baseline.",
    "Replaces fragile variant-name string predicates with explicit per-target workload lists and exact array membership via contains(matrix.workloads, ...), which is valid GitHub Actions semantics and removes the policy-from-naming coupling.",
    "Generator is standard-library-only Python, deterministic (LF newlines, stable ordering), with a genuinely non-mutating --check that prints a unified diff and remediation hint.",
    "Validation cross-checks manifests against every .mise/config.<variant>.toml, rejects duplicate/unknown/unused/empty workloads, and conservatively rejects YAML-unsafe scalar values before interpolation.",
    "Tests were actually executed in the trajectory (8 unittest cases passing, ruff check/format passing, exact mise commands verified), and caught real bugs during development (f-string brace escaping, relative_to on temp paths).",
    "Drift enforcement is wired into the existing ci:lint hygiene path and documented in the development overview, matching the required contributor commands exactly."
  ],
  "summary": "The patch introduces two TOML manifests (targets and workloads), a deterministic stdlib Python generator with validation and a non-mutating drift check, regenerates the checked-in workflow with behavior preserved, adds focused unittest coverage, wires both into mise tasks and ci:lint, and documents the workflow. The change is well-scoped, tested, and mergeable.",
  "task_id": "ce-06-maplibre-ffi-ci",
  "test_quality": 4
}
