{
  "blinded_to_model_identity": true,
  "blockers": [
    "Successful clone wrapper progress is captured and then discarded instead of being preserved on stderr.",
    "The authoritative verifier reports that redirected wrapper progress is not preserved on stderr.",
    "The git update path remains unfixed, and the verifier reports both stdout contamination and failure to preserve update diagnostics.",
    "The regression test discards stderr and verifies only absence from generated stdout, so it cannot detect lost diagnostics."
  ],
  "can_override_deterministic": false,
  "code_clarity": 3,
  "deterministic_result_path": "reports/experiments/real-models-v1-stage-a/evidence/runs/opencode-go__kimi-k2.7-code__ce-01-antidote-output__default__ask_user__r01/matrix-record.json",
  "mergeable": false,
  "overall_reasoning": "The candidate recognized the need to isolate git stdout and made a thoughtful effort to preserve output on failures. However, the requirement is to redirect noisy wrapper output without hiding useful diagnostics, not to retain it only on failure. The verifier confirms diagnostic loss and the untouched update defect, while the regression test cannot observe either issue.",
  "proctor": "Hermes Agent delegated blinded reviewer",
  "proctor_model": "openai/gpt-5.6-sol",
  "rating_rationales": {
    "code_clarity": "The explicit clone_output and clone_status flow is understandable, but it is more complex than necessary and the conditional emission makes the diagnostic policy easy to misread.",
    "repository_fit": "The shell constructs are plausible for the codebase and failure status is retained, but suppressing successful diagnostic output and omitting update behavior do not fit the repository-wide output contract shown by the verifier.",
    "scope_discipline": "The change is localized, but it handles only clone and introduces capture logic where direct stream redirection would satisfy the requirement more completely and simply.",
    "security_and_safety": "Failure output captured from stdout is preserved, which is safer than unconditional deletion, but successful wrapper diagnostics are silently lost and update behavior remains unsafe for generated output.",
    "test_quality": "The test demonstrates that noisy clone stdout does not enter the generated script, but redirecting stderr to /dev/null means it never verifies that diagnostics remain visible, and no update case is covered."
  },
  "repository_fit": 3,
  "run_id": "20260716T085901Z-ce-01-antidote-output-2822821-1784192341812935294",
  "scope_discipline": 3,
  "security_and_safety": 3,
  "strengths": [
    "The patch prevents captured clone stdout from contaminating a successful generated script.",
    "It records the clone exit status immediately and preserves failure propagation.",
    "Captured stdout is emitted to stderr when the clone fails, providing partial diagnostic preservation.",
    "The test uses a wrapper that specifically emits noise for clone operations and restores the mock afterward."
  ],
  "summary": "This provides partial stream isolation and preserves captured stdout on clone failure, but silently drops successful progress, misses updates, and tests only half of the required contract.",
  "task_id": "ce-01-antidote-output",
  "test_quality": 2
}
