{
  "blinded_to_model_identity": false,
  "blockers": [
    "Operational git calls in antidote-update still allow wrapper stdout to contaminate command output instead of routing it to stderr."
  ],
  "can_override_deterministic": false,
  "code_clarity": 5,
  "deterministic_result_path": "results/opencode-go__mimo-v2.5-pro__ce-01-antidote-output__default__ask_user__r01.json",
  "mergeable": false,
  "overall_reasoning": "The agent correctly traced clone-time contamination to antidote-script and used the direct stream-preserving fix: redirecting clone stdout to stderr while retaining stderr and exit status. The patch is small, idiomatic, and accompanied by repository-native regression coverage; both focused and full suites passed. However, the investigation also opened antidote-update and then incorrectly concluded that its operational git calls were already handled. Fetch, pull, and submodule operations have the same noisy-wrapper risk, and the deterministic verifier confirmed that their stdout still contaminates normal command output while diagnostics are not routed as required. The committed test covers only clone output, discards stderr rather than asserting diagnostic preservation, and therefore misses the sibling path. This is a valid behavioral and investigation-scope failure, so the otherwise good partial fix is not mergeable as a complete response. No clarification was needed because the stream contract was clear.",
  "proctor": "Hermes Agent",
  "proctor_model": "openai/gpt-5.6-sol",
  "rating_rationales": {
    "code_clarity": "The one-line redirection is idiomatic Zsh and the regression description clearly states the behavior under test.",
    "repository_fit": "The change follows the existing Zsh implementation and clitest Markdown conventions without introducing dependencies or abstractions.",
    "scope_discipline": "The production and test edits are proportional, but the investigation stopped at clone even after identifying the sibling operational git calls in antidote-update.",
    "security_and_safety": "The clone change preserves command failure and both streams, but leaving update operations untreated means the requested output-isolation property is incomplete.",
    "test_quality": "The regression realistically injects noisy wrapper stdout and the agent ran focused and full suites, but it covers only clone and suppresses stderr instead of proving useful diagnostics remain visible."
  },
  "repository_fit": 5,
  "run_id": "20260718T050903Z-ce-01-antidote-output-215989-1784351343009011295",
  "scope_discipline": 3,
  "security_and_safety": 3,
  "strengths": [
    "Correctly identified and fixed clone-time stdout contamination without hiding diagnostics.",
    "Added focused repository-native regression coverage for a noisy git wrapper.",
    "Ran both focused and full test suites and committed a clean, proportional patch."
  ],
  "summary": "Clean and well-tested clone-path fix, but incomplete because equivalent update operations still leak wrapper stdout.",
  "task_id": "ce-01-antidote-output",
  "test_quality": 3
}
