{
  "blinded_to_model_identity": true,
  "blockers": [
    "Redirecting clone stdout to /dev/null discards useful wrapper diagnostics rather than preserving them on stderr.",
    "The authoritative verifier reports that redirected wrapper progress is not preserved on stderr.",
    "The authoritative verifier reports that failed-command diagnostics are not visible on stderr.",
    "The git update path remains unfixed, with stdout contamination and missing stderr diagnostics reported.",
    "The regression test explicitly discards stderr and therefore cannot verify the diagnostic-preservation requirement."
  ],
  "can_override_deterministic": false,
  "code_clarity": 4,
  "deterministic_result_path": "reports/experiments/real-models-v1-stage-a/evidence/runs/neuralwatt__qwen3.6-35b__ce-01-antidote-output__default__ask_user__r01/matrix-record.json",
  "mergeable": false,
  "overall_reasoning": "This patch demonstrates the contamination symptom and prevents it for clone operations, but does so with the wrong stream policy. Useful output must move to stderr, not disappear. The verifier establishes both diagnostic loss and an unfixed update path, so the patch is not mergeable despite its concise implementation and partial regression check.",
  "proctor": "Hermes Agent delegated blinded reviewer",
  "proctor_model": "openai/gpt-5.6-sol",
  "rating_rationales": {
    "code_clarity": "The redirection is simple and readable, though the simplicity masks an incorrect policy of unconditional diagnostic deletion.",
    "repository_fit": "The implementation preserves generated-output purity but does so by suppressing information rather than following the stderr diagnostic convention already visible in antidote-script.",
    "scope_discipline": "The patch is localized and focused on the reported symptom, but it handles only clone and does not honor the equally important requirement to retain diagnostics.",
    "security_and_safety": "Silently dropping command output reduces observability of clone failures; the verifier specifically confirms failed-command diagnostics are not visible.",
    "test_quality": "The wrapper marker and explicit negative assertion provide some regression value for stdout cleanliness, but stderr is discarded, failure diagnostics are untested, and update behavior is absent."
  },
  "repository_fit": 2,
  "run_id": "20260716T081606Z-ce-01-antidote-output-2822821-1784189766077948720",
  "scope_discipline": 3,
  "security_and_safety": 2,
  "strengths": [
    "The production diff is minimal and prevents clone wrapper stdout from contaminating generated output.",
    "The test captures command output and explicitly checks that the noise marker is absent.",
    "The noisy git function is restored after the test.",
    "The existing clone exit-status propagation is retained."
  ],
  "summary": "A narrowly implemented contamination check passes by deleting clone stdout, but diagnostics are lost, updates remain broken, and the test validates only clean stdout rather than the complete required behavior.",
  "task_id": "ce-01-antidote-output",
  "test_quality": 2
}
