{
  "blinded_to_model_identity": true,
  "blockers": [
    "Redirecting clone stdout to /dev/null explicitly hides potentially useful wrapper and failed-command diagnostics.",
    "The authoritative verifier reports that redirected wrapper progress is not preserved on stderr.",
    "The authoritative verifier reports that failed-command diagnostics are not visible on stderr.",
    "The git update path remains unfixed, with both stdout contamination and missing stderr diagnostics reported.",
    "The test asserts that wrapper output is absent even from combined stdout and stderr, contradicting the requirement to preserve useful diagnostics.",
    "Repeatedly cloning the same bar/foo target makes later assertions potentially bypass the clone path and therefore become vacuous."
  ],
  "can_override_deterministic": false,
  "code_clarity": 4,
  "deterministic_result_path": "reports/experiments/real-models-v1-stage-a/evidence/runs/opencode-go__mimo-v2.5-pro__ce-01-antidote-output__default__ask_user__r01/matrix-record.json",
  "mergeable": false,
  "overall_reasoning": "Although concise, the solution treats diagnostic output as disposable. The requirement explicitly says not to hide useful diagnostics, and the verifier confirms both clone diagnostic loss and an untouched update path. The regression coverage reinforces the wrong behavior and may not consistently exercise cloning, so substantial correction is required.",
  "proctor": "Hermes Agent delegated blinded reviewer",
  "proctor_model": "openai/gpt-5.6-sol",
  "rating_rationales": {
    "code_clarity": "The >/dev/null operation is syntactically clear, but its clear behavior is the wrong contract because it silently discards stdout diagnostics.",
    "repository_fit": "Suppressing command output is inconsistent with the repository behavior implied by the existing stderr status message and with the verifier's required stdout/stderr separation.",
    "scope_discipline": "The diff is small and localized, but it addresses only clone and chooses suppression rather than the requested redirection of useful diagnostics.",
    "security_and_safety": "Discarding wrapper output can conceal actionable failure information; the verifier confirms failed-command diagnostics are lost, making failures harder to diagnose safely.",
    "test_quality": "The test expects noisy output to disappear from 2>&1, which encodes behavior opposite to the requirement, and reuse of bar/foo means subsequent calls may not invoke git clone at all."
  },
  "repository_fit": 2,
  "run_id": "20260716T094647Z-ce-01-antidote-output-2822821-1784195207564416601",
  "scope_discipline": 3,
  "security_and_safety": 2,
  "strengths": [
    "The production change is small and prevents clone wrapper stdout from entering generated output.",
    "The patch attempts to add a regression scenario using a noisy git wrapper.",
    "The existing clone exit-status propagation remains intact."
  ],
  "summary": "The patch prevents one source of contamination by discarding output, but that violates the diagnostic-preservation requirement, leaves updates broken, and is supported by weak, potentially vacuous tests.",
  "task_id": "ce-01-antidote-output",
  "test_quality": 1
}
