{
  "blinded_to_model_identity": false,
  "blockers": [
    "Property-name completion does not traverse oneOf/anyOf object branches, so composed object schemas return no branch properties."
  ],
  "can_override_deterministic": false,
  "code_clarity": 4,
  "deterministic_result_path": "results/opencode-go__deepseek-v4-pro__ce-03-jvl-completions__default__ask_user__r01.json",
  "mergeable": false,
  "overall_reasoning": "The agent investigated the schema value-completion path, LSP item construction, existing fixtures, and neighboring tests, then implemented localized recursive oneOf/anyOf value collection, nullable type-array handling, reference following, a depth guard, and deterministic deduplication. It added unit and realistic in-process LSP tests and ran focused suites, broader LSP regression tests, formatting, and clippy. However, the investigation treated composed-schema support primarily as value completion and did not extend the separate property-collection path from allOf to oneOf/anyOf. Deterministic verification consequently found that an object composed with oneOf returns no property suggestions. That is a direct semantic requirement of handling composition cases for completions, not an exact-message or hidden-implementation expectation, so the behavioral failure is valid and the patch is not mergeable as submitted. The substantial test additions are generally useful but omit the decisive composed-object property workflow. No clarification was necessary because the repository exposes separate property and value completion paths and the requested behavior is discoverable from ordinary JSON Schema and LSP usage.",
  "proctor": "Hermes Agent",
  "proctor_model": "openai/gpt-5.6-sol",
  "rating_rationales": {
    "code_clarity": "The recursive helper, depth guard, and explicit deduplication are readable and localized, though string-encoded suggestion keys are more ad hoc than a typed equality strategy.",
    "repository_fit": "The production change stays in the established schema completion module and the tests use the repository's in-process LSP client and fixture conventions.",
    "scope_discipline": "Production edits are focused, but roughly 450 added lines across overlapping unit and LSP cases are disproportionate while still leaving the parallel property-completion behavior untouched.",
    "security_and_safety": "The implementation preserves bounded recursion and local fragment-reference handling and introduces no new I/O, network, unsafe code, or credential exposure.",
    "test_quality": "The tests realistically cover composed values, deduplication, nullable booleans, and end-to-end LSP edits, but they never exercise property suggestions from oneOf/anyOf object branches, which is the semantic gap found by verification."
  },
  "repository_fit": 4,
  "run_id": "20260718T070157Z-ce-03-jvl-completions-640731-1784358117899371627",
  "scope_discipline": 3,
  "security_and_safety": 4,
  "strengths": [
    "Traced value suggestions through schema traversal and LSP completion-item construction rather than patching output formatting.",
    "Correctly handles nested oneOf/anyOf values, nullable type arrays, fragment references, recursion limits, and deterministic deduplication.",
    "Added both focused unit coverage and realistic in-process LSP tests and ran lint and broad regression checks."
  ],
  "summary": "Strong composed-value implementation and realistic tests, but the omitted oneOf/anyOf object-property path causes a valid behavioral failure.",
  "task_id": "ce-03-jvl-completions",
  "test_quality": 3
}
