{
  "blinded_to_model_identity": true,
  "blockers": [
    "Selector semantics are inconsistent for valid multi-value manifests: applies_to treats only_prefixes as OR, but render_condition emits them joined by AND; only_variants is emitted as an unparenthesized OR expression, so combining multiple values with exclusions changes precedence and can run steps on unintended variants.",
    "Template generation does not require exactly one matrix marker and one steps marker; missing or duplicate markers can silently produce an incomplete or duplicated workflow, and the repository-manifest test would not detect a missing marker."
  ],
  "can_override_deterministic": false,
  "code_clarity": 4,
  "deterministic_result_path": ".runs/experiments/real-models-v1-behavioral-rerun-ce06/results/kimi-subscription__kimi-k3__ce-06-maplibre-ffi-ci__default__ask_user__r01.json",
  "mergeable": false,
  "overall_reasoning": "This is a strong, task-aligned implementation with a sensible template-plus-manifest design, deterministic generation, validation, CI enforcement, hook integration, and useful tests. The current checked-in manifests render the intended workflow, but mergeability must consider the supported schema rather than only today's data. Multiple only_prefixes values pass validation using OR semantics yet render as mutually conjunctive startsWith checks, while multiple only_variants values combined with exclusions are emitted without parentheses and therefore follow GitHub expression precedence rather than applies_to semantics. A contributor can consequently author a schema-valid policy that silently runs on the wrong target set. The renderer also silently tolerates absent or duplicate generation markers, making malformed templates capable of producing incomplete or duplicated workflows without a targeted failure. Constrain these fields to one value or render grouped OR expressions consistently, and require exactly one occurrence of each marker with tests.",
  "proctor": "Independent model-blind reviewer",
  "proctor_model": "openai-subscription/gpt-5.6-sol",
  "rating_rationales": {
    "code_clarity": "The generator is well organized with typed data classes, small parsing and rendering functions, explicit validation, and actionable errors. Clarity is reduced by selector behavior that is not consistently defined between applies_to and render_condition.",
    "repository_fit": "The mise task, stdlib Python implementation, hk integration, generated-file header, and documentation align well with existing repository conventions. The unchecked template marker contract and overly permissive selector schema need tightening.",
    "scope_discipline": "Changes remain focused on declarative CI policy, workflow generation, drift enforcement, tests, and directly relevant contributor documentation.",
    "security_and_safety": "The patch introduces no meaningful privilege escalation, secret exposure, untrusted network access, or unsafe file handling. Manifest data is trusted repository input, and check mode is non-mutating.",
    "test_quality": "The suite exercises core parsing, validation, rendering, and check-mode behavior, but it misses legal multi-value only_variants and only_prefixes combinations and does not verify that each template marker occurs exactly once."
  },
  "repository_fit": 4,
  "run_id": "20260721T164026Z-ce-06-maplibre-ffi-ci-3065908-1784652026354764700",
  "scope_discipline": 5,
  "security_and_safety": 5,
  "strengths": [
    "Moves the CI matrix and step applicability policy into clear TOML manifests while preserving current runner mappings and step conditions.",
    "Provides the requested generation and non-mutating check commands and enforces drift in CI and repository hooks.",
    "Validates manifest names, unknown keys, mise configuration coverage, stale references, unmatched selectors, and rules that exclude every variant.",
    "Uses only the Python standard library and emits deterministic output with useful drift diffs.",
    "Includes meaningful tests for parsing, validation, rendering, check mode, and repository manifests.",
    "Documents the generated workflow process for contributors."
  ],
  "summary": "The overall architecture fits the task well, preserves current CI behavior, and provides strong contributor-facing enforcement. However, the accepted manifest schema can generate conditions whose GitHub Actions semantics differ from the generator's own validation semantics, and template markers are not structurally validated. Those correctness gaps should be fixed before merge.",
  "task_id": "ce-06-maplibre-ffi-ci",
  "test_quality": 3
}
