{
  "blinded_to_model_identity": false,
  "blockers": [],
  "can_override_deterministic": false,
  "code_clarity": 5,
  "deterministic_result_path": "results/zai__glm-5.2__ce-01-antidote-output__default__ask_user__r01.json",
  "mergeable": true,
  "overall_reasoning": "The patch correctly identifies stdout from the clone subprocess as the contamination source and redirects it to stderr, preserving both wrapper progress and native Git diagnostics while retaining failure propagation. The implementation is a proportional one-line production change. The added repository-native regression test exercises clean generated output and visible diagnostics, and the agent verified that it failed before the fix and passed afterward. No clarification was needed because the reported generated-script behavior was sufficiently specific.",
  "proctor": "Hermes Agent",
  "proctor_model": "openai/gpt-5.6-sol",
  "rating_rationales": {
    "code_clarity": "The one-line stream redirection is direct and idiomatic for the Zsh codebase.",
    "repository_fit": "The change uses the existing shell implementation and clitest Markdown conventions without introducing new abstractions or dependencies.",
    "scope_discipline": "The production change is limited to the subprocess whose stdout can contaminate generated plugin scripts, plus focused regression coverage.",
    "security_and_safety": "Diagnostics and nonzero exit behavior remain visible and intact; no output is silently discarded.",
    "test_quality": "The regression uses the repository's Git shim and checks both sides of the stream contract; the agent also demonstrated that it fails without the fix and ran the full suite."
  },
  "repository_fit": 5,
  "run_id": "20260717T153919Z-ce-01-antidote-output-1273157-1784302759238741353",
  "scope_discipline": 5,
  "security_and_safety": 5,
  "strengths": [
    "Traced the generated-script call path before editing.",
    "Preserved useful stdout and stderr diagnostics by routing rather than suppressing them.",
    "Added a focused regression and verified both pre-fix failure and full-suite success."
  ],
  "summary": "Mergeable, focused fix for generated-script stdout contamination with strong repository-native regression coverage.",
  "task_id": "ce-01-antidote-output",
  "test_quality": 5
}
